{
  "id": "msg_01J9Z8K2",
  "client_id": null,
  "conversation_id": "conv_01J9Z7Q1",
  "type": "text",
  "sender": { "type": "bot", "id": "bot_default", "name": "Clomni", "avatar_url": "https://cdn.clomni.az/a/bot.png" },
  "created_at": "2026-10-01T10:30:00.000Z",
  "seq": 42,
  "lang": "az",
  "flow": { "flow_id": "flw_lang", "node_id": "A", "version": 7, "interactive": true },
  "content": { "text": "Salam!" },
  "fallback_text": "Salam!",
  "meta": {}
}
