{
  "id": "msg_f68",
  "client_id": null,
  "reply_to": {
    "id": "msg_f60",
    "sender": {
      "type": "user",
      "name": "Aysel Məmmədova"
    },
    "excerpt": null,
    "kind": "text"
  },
  "conversation_id": "conv_5521",
  "type": "text",
  "sender": {
    "type": "operator",
    "id": "op_7",
    "name": "Leyla",
    "avatar_url": "https://app.clomni.ai/a/leyla.png"
  },
  "created_at": "2026-10-05T09:16:00Z",
  "seq": 18,
  "lang": "az",
  "flow": null,
  "content": {
    "text": "Bu barədə yazırsınız?"
  },
  "fallback_text": "Bu barədə yazırsınız?",
  "meta": {}
}
