{
  "id": "msg_f67",
  "client_id": null,
  "reply_to": {
    "id": "msg_f62",
    "sender": {
      "type": "user",
      "name": "Aysel Məmmədova"
    },
    "excerpt": "qebz.jpg",
    "kind": "image"
  },
  "conversation_id": "conv_5521",
  "type": "text",
  "sender": {
    "type": "operator",
    "id": "op_7",
    "name": "Leyla",
    "avatar_url": "https://app.clomni.ai/a/leyla.png"
  },
  "created_at": "2026-10-05T09:14:00Z",
  "seq": 16,
  "lang": "az",
  "flow": null,
  "content": {
    "text": "Qəbzi gördüm, pul 2 iş günü ərzində qayıdacaq"
  },
  "fallback_text": "Qəbzi gördüm, pul 2 iş günü ərzində qayıdacaq",
  "meta": {}
}
