{
  "id": "msg_f104",
  "client_id": null,
  "reply_to": {
    "id": "msg_f100",
    "sender": {
      "type": "user",
      "name": "Aysel Məmmədova"
    },
    "excerpt": "Səsli mesaj (0:14)",
    "kind": "audio"
  },
  "conversation_id": "conv_5521",
  "type": "text",
  "sender": {
    "type": "operator",
    "id": "op_42",
    "name": "Leyla",
    "avatar_url": "https://app.clomni.ai/a/leyla.png"
  },
  "created_at": "2026-10-01T10:32:00Z",
  "seq": 21,
  "lang": "az",
  "flow": null,
  "content": {
    "text": "Eşitdim, kuryerə xəbər verirəm"
  },
  "fallback_text": "Eşitdim, kuryerə xəbər verirəm",
  "meta": {}
}
