{
  "id": "msg_f01",
  "client_id": null,
  "conversation_id": "conv_5521",
  "type": "text",
  "sender": {
    "type": "bot",
    "id": "bot_default",
    "name": "Clomni",
    "avatar_url": "https://app.clomni.ai/a/bot.png"
  },
  "created_at": "2026-10-01T10:30:00Z",
  "seq": 1,
  "lang": "az",
  "flow": {
    "flow_id": "flw_apar_az",
    "node_id": "A0",
    "version": 7,
    "interactive": false
  },
  "content": {
    "text": "Salam! Siz Apar-ın dəstək bölməsi ilə əlaqəyə keçmisiniz."
  },
  "fallback_text": "Salam! Siz Apar-ın dəstək bölməsi ilə əlaqəyə keçmisiniz.",
  "meta": {}
}
