{
  "id": "msg_f15",
  "client_id": null,
  "conversation_id": "conv_5521",
  "type": "quick_replies",
  "sender": {
    "type": "bot",
    "id": "bot_default",
    "name": "Clomni",
    "avatar_url": "https://app.clomni.ai/a/bot.png"
  },
  "created_at": "2026-10-01T10:30:00Z",
  "seq": 14,
  "lang": "az",
  "flow": {
    "flow_id": "flw_apar_az",
    "node_id": "OK0",
    "version": 7,
    "interactive": true
  },
  "content": {
    "buttons": [
      {
        "id": "o_ok",
        "title": "Aydındır",
        "icon": null,
        "payload": "node:OK"
      }
    ],
    "input_disabled": false
  },
  "fallback_text": "Aydındır",
  "meta": {}
}
