{
  "id": "msg_f100",
  "client_id": "7d1c2b3a-4e5f-4a6b-8c7d-9e0f1a2b3c4d",
  "conversation_id": "conv_5521",
  "type": "audio",
  "sender": {
    "type": "user",
    "id": "usr_8f2a",
    "name": "Aysel Məmmədova"
  },
  "created_at": "2026-10-01T10:31:00Z",
  "seq": 18,
  "lang": "az",
  "flow": null,
  "content": {
    "url": "https://app.clomni.ai/f/voice-7d1c.m4a",
    "mime": "audio/mp4",
    "size": 96412,
    "duration_ms": 14260,
    "waveform": [
      8,
      28,
      21,
      37,
      35,
      45,
      47,
      49,
      54,
      47,
      54,
      39,
      47,
      28,
      35,
      19,
      21,
      13,
      12,
      12,
      9,
      19,
      15,
      34,
      29,
      54,
      53,
      74,
      76,
      89,
      92,
      94,
      97,
      88,
      91,
      72,
      75,
      50,
      53,
      33,
      32,
      19,
      16,
      13,
      8,
      14,
      9,
      23,
      15,
      35,
      29,
      46,
      43,
      52,
      51,
      52,
      52,
      44,
      47,
      31,
      38,
      18,
      28,
      13
    ],
    "caption": null
  },
  "fallback_text": "Səsli mesaj (0:14)",
  "meta": {}
}
