{
  "id": "msg_f66",
  "client_id": "0b7d4f2e-9a61-4c8b-b3f0-5e2d1a7c6b94",
  "reply_to": {
    "id": "msg_f65",
    "sender": {
      "type": "operator",
      "name": "Leyla"
    },
    "excerpt": "Ödənişi kartla etmisiniz, yoxsa balansdan? Qəbzin şəklini də göndərə bilərsiniz, yoxlayaq.",
    "kind": "text"
  },
  "conversation_id": "conv_5521",
  "type": "text",
  "sender": {
    "type": "user",
    "id": "usr_12345",
    "name": "Aysel Məmmədova"
  },
  "created_at": "2026-10-05T09:12:00Z",
  "seq": 14,
  "lang": "az",
  "flow": null,
  "content": {
    "text": "Bəli, kartla ödəmişdim"
  },
  "fallback_text": "Bəli, kartla ödəmişdim",
  "meta": {}
}
