{
  "id": "msg_f17",
  "client_id": null,
  "conversation_id": "conv_5521",
  "type": "image",
  "sender": {
    "type": "operator",
    "id": "op_42",
    "name": "Leyla",
    "avatar_url": "https://app.clomni.ai/a/leyla.png"
  },
  "created_at": "2026-10-01T10:46:00Z",
  "seq": 16,
  "lang": "az",
  "flow": null,
  "content": {
    "url": "https://app.clomni.ai/f/receipt.png",
    "thumb_url": null,
    "width": null,
    "height": null,
    "caption": null
  },
  "fallback_text": "Şəkil",
  "meta": {}
}
