{
  "id": "msg_f19",
  "client_id": null,
  "conversation_id": "conv_5521",
  "type": "form",
  "sender": {
    "type": "bot",
    "id": "bot_default",
    "name": "Clomni",
    "avatar_url": "https://app.clomni.ai/a/bot.png"
  },
  "created_at": "2026-10-01T10:30:00Z",
  "seq": 18,
  "lang": "az",
  "flow": {
    "flow_id": "flw_apar_az",
    "node_id": "F",
    "version": 7,
    "interactive": false
  },
  "content": {
    "text": "Sizə geri dönə bilməyimiz üçün məlumatlarınızı qeyd edin.",
    "form_id": "frm_contact",
    "fields": [
      {
        "key": "name",
        "type": "text",
        "label": "Ad, soyad",
        "required": true,
        "max_length": 80
      },
      {
        "key": "phone",
        "type": "phone",
        "label": "Telefon",
        "required": true,
        "default_country": "AZ"
      },
      {
        "key": "email",
        "type": "email",
        "label": "Email",
        "required": false
      }
    ],
    "submit_title": "Göndər",
    "submitted": {
      "name": "Aysel Məmmədova",
      "phone": "+994501234567",
      "email": "aysel@example.com"
    }
  },
  "fallback_text": "Göndərildi",
  "meta": {}
}
