{
  "id": "msg_f02",
  "client_id": null,
  "conversation_id": "conv_5521",
  "type": "text",
  "sender": {
    "type": "operator",
    "id": "op_42",
    "name": "Leyla",
    "avatar_url": "https://app.clomni.ai/a/leyla.png"
  },
  "created_at": "2026-10-01T10:41:00Z",
  "seq": 2,
  "lang": "az",
  "flow": null,
  "content": {
    "text": "**Gedişinizi yoxladıq.** Balansınıza *2 AZN* qaytarıldı.\nƏtraflı: [şərtlər](https://apar.az/sertler)"
  },
  "fallback_text": "Gedişinizi yoxladıq. Balansınıza 2 AZN qaytarıldı.",
  "meta": {}
}
