{
  "id": "msg_f28",
  "client_id": null,
  "conversation_id": "conv_5521",
  "type": "rating",
  "sender": {
    "type": "bot",
    "id": "bot_default",
    "name": "Clomni",
    "avatar_url": "https://app.clomni.ai/a/bot.png"
  },
  "created_at": "2026-10-01T11:02:00Z",
  "seq": 27,
  "lang": "az",
  "flow": null,
  "content": {
    "text": "Xidmətimizi qiymətləndirin",
    "scale": "emoji_5",
    "comment": "optional",
    "submitted": null
  },
  "fallback_text": "Xidmətimizi 1-5 qiymətləndirin",
  "meta": {}
}
